{
  "$schema": "https://unperson-12359.github.io/trading-knowledge-library/schemas/skill-alias.schema.json",
  "schema_version": 1,
  "type": "alias",
  "legacy_concept_id": "parameterized-analytics/32-period-simple-return",
  "legacy_skill_name": "tkl-32-period-simple-return",
  "legacy_display_name": "32-period simple return",
  "legacy_terms": [
    "32-period return",
    "32-period holding period return",
    "32-period price return"
  ],
  "canonical_concept_id": "parameterized-analytics/n-period-simple-return",
  "canonical_skill_name": "tkl-n-period-simple-return",
  "parameters": {
    "periods": 32
  },
  "canonical_detail_url": "https://unperson-12359.github.io/trading-knowledge-library/skills/tkl-n-period-simple-return/?periods=32",
  "canonical_profile_url": "https://unperson-12359.github.io/trading-knowledge-library/api/v1/skills/tkl-n-period-simple-return.json"
}
